{
  "faq": [
    {
      "answer": "Ecobaby es un centro de ecografías emocionales en 5D en Granada. No realizamos ecografías médicas, diagnósticas ni revisiones de embarazo.",
      "question": "¿Qué es Ecobaby?"
    },
    {
      "answer": "Estamos en C. San Isidro, 12, Local B1, Centro, 18005 Granada. Aquí tienes la ubicación: https://maps.app.goo.gl/w9RLig2nhnTzRikS9",
      "question": "¿Dónde estáis en Granada?"
    },
    {
      "answer": "Lunes a viernes de 10:00 a 14:30 y de 16:00 a 21:00. Sábados de 10:00 a 15:00 y de 16:00 a 20:00.",
      "question": "¿Cuál es el horario de Ecobaby Granada?"
    },
    {
      "answer": "El teléfono de recepción es 952 22 11 29 y el WhatsApp es 711 20 94 44.",
      "question": "¿Cuál es el teléfono de Ecobaby?"
    },
    {
      "answer": "La sesión de Niño o niña cuesta 59 €. Se realiza desde la semana 14 hasta 17/18 según criterio de agenda.",
      "question": "¿Cuánto cuesta la ecografía del sexo (Niño o niña)?"
    },
    {
      "answer": "La sesión Básica cuesta 75 € y es a partir de la semana 20.",
      "question": "¿Cuánto cuesta la Básica?"
    },
    {
      "answer": "La Face to Face cuesta 89 €. Es a partir de la semana 20, recomendada especialmente entre semanas 26 y 31, ideal 28-29.",
      "question": "¿Cuánto cuesta la Face to Face?"
    },
    {
      "answer": "La Eco Deluxe cuesta 119 € y es a partir de la semana 20 si la paciente la pide o solicita opciones.",
      "question": "¿Cuánto cuesta la Eco Deluxe?"
    },
    {
      "answer": "El masaje cuesta 35 €, o 28 € en promoción de primera sesión. Se puede hacer en cualquier semana.",
      "question": "¿Cuánto cuesta el masaje?"
    },
    {
      "answer": "No, solo aceptamos efectivo o Bizum. No aceptamos tarjeta.",
      "question": "¿Aceptáis tarjeta?"
    },
    {
      "answer": "No, no lo cubren los seguros ni las mutuas porque son ecografías emocionales sin diagnóstico médico.",
      "question": "¿Cobran los seguros o mutuas?"
    },
    {
      "answer": "Sí, hay varios parkings cercanos. Te paso la información autorizada por WhatsApp. Para acceder a nuestro Centro de Ecobaby Granada hay varios parkings cercanos. C/ SAN ANTON acceso restringido. Parking Puerta Real: https://share.google/4KUMljLb6c3ueirl7. Parking Corte Inglés de Puerta Real: https://share.google/uzwte9xGmqS38IDgT. Parking Palacio de Congresos: https://share.google/okE0Gyoh8ukBzBqfm. Parking Hotel Luna Centro, por Calle Nueva de la Virgen: https://share.google/RkS5Q8CPGh8XGOGCH.",
      "question": "¿Hay parking cerca?"
    },
    {
      "answer": "La Econatal es una sesión gratuita entre la semana 8 y la 12. Es una primera toma de contacto con el bebé, mostrándolo en 2D y 5D durante 15 minutos y escuchando el corazón. El único requisito es dejar abonada otra sesión para más adelante.",
      "question": "¿Qué es la Econatal?"
    },
    {
      "answer": "Si ya has venido a Ecobaby, cuestan 38 €. Si no eres paciente, cuestan 45 €. Requieren cita previa.",
      "question": "¿Cuánto cuestan los pendientes para bebé?"
    },
    {
      "answer": "No, en Ecobaby solo hacemos ecografías emocionales. No realizamos ecografías estructurales, morfológicas, diagnósticas, cribados ni revisiones médicas del embarazo.",
      "question": "¿Hacéis ecografías médicas o morfológicas?"
    },
    {
      "answer": "El envío normal cuesta 7 € y el envío urgente 10 €. Se pide código postal antes de informar el importe.",
      "question": "¿Cuánto cuestan los envíos de productos?"
    },
    {
      "answer": "Si tu cita es para Econatal, podéis venir la pareja e hijos (si tenéis). Si sois alguno más no hay problema. En el resto de sesiones podéis venir entre 7 y 10 personas como máximo (si sois alguno más no hay problema).",
      "question": "¿Con cuántas personas puedo ir a mi cita?",
      "condition": null
    },
    {
      "answer": "En la Econatal podéis venir la pareja e hijos (si tenéis). Si sois alguno más no hay problema.",
      "question": "¿Cuántas personas pueden venir a una Econatal?",
      "condition": null
    },
    {
      "answer": "En el resto de sesiones podéis venir en total de 7 a 10 personas como máximo (si sois alguno más no hay problema).",
      "question": "¿Cuántas personas pueden venir a una sesión más avanzada?",
      "condition": null
    },
    {
      "answer": "En las sesiones Econatales de 8 a 12 semanas suelen venir los papás y los hermanos del bebé. A partir de 14 semanas de gestación podéis venir 6 personas más la mamá (si sois alguno más no hay problema).",
      "question": "¿Cuántas personas pueden venir a una Econatal de 8 a 12 semanas?",
      "condition": null
    }
  ],
  "rules": [
    {
      "id": "ask_about_existing_appointment",
      "note": "El bot responde desde el contexto sin llamar tools. Si no aparece la cita, crear tarea.",
      "action": "allow",
      "intent": "appointment_inquiry",
      "description": "La paciente consulta información sobre citas que ya tiene reservadas."
    },
    {
      "id": "confirm_existing_appointment",
      "note": "Ejecutar manage_schedule_block_status (CONFIRMADA) para cada cita del día. BAJO NINGUNA CIRCUNSTANCIA crear tarea administrativa. Enviar plantilla literal.",
      "action": "allow",
      "intent": "appointment_confirmation",
      "description": "La paciente confirma asistencia a una cita existente."
    },
    {
      "id": "no_task_on_confirmation",
      "note": "NO USAR create_task cuando la paciente confirma asistencia. Solo marcar CONFIRMADA con manage_schedule_block_status. Si hay varias citas el mismo día, usar manage_all_schedule_blocks_for_date.",
      "action": "allow",
      "intent": "appointment_confirmation",
      "description": "Reforzar que la confirmacion de una cita existente nunca genera tarea administrativa."
    },
    {
      "id": "cancel_existing_appointment",
      "note": "Una cita: CANCELADA. Varias citas el mismo día: gestionar en lote. No explicar normativas.",
      "action": "allow",
      "intent": "appointment_cancellation",
      "description": "La paciente cancela una cita existente o indica que no asistirá."
    },
    {
      "id": "reschedule_existing_appointment",
      "note": "Una cita: cancelar y crear tarea para reprogramación. Varias citas: crear tarea.",
      "action": "allow",
      "intent": "appointment_reschedule_request",
      "description": "La paciente quiere cambiar, adelantar o atrasar una cita existente."
    },
    {
      "id": "scheduling_request_to_task",
      "note": "En modo tasks-only, recopilar semanas de gestación o fecha de última regla, sesión/pack deseado, datos de contacto y crear tarea. Cuando la solicitud es sobre el sexo, usar el protocolo pack_two_moments_promotion como mensaje promocional autorizado.",
      "action": "allow",
      "intent": "scheduling_request",
      "description": "La paciente solicita una nueva ecografía, sesión, pack o consulta.",
      "redirectToTask": true
    },
    {
      "id": "general_inquiry",
      "note": "Responder directamente con la información del contexto. No ofrecer ecografías como sustituto de revisiones médicas.",
      "action": "allow",
      "intent": "general_inquiry",
      "description": "La paciente pregunta por tratamientos, precios fijos, médicos, contacto, horarios, servicios o métodos de pago."
    },
    {
      "id": "running_late",
      "note": "Marcar EN_CAMINO y crear tarea para seguimiento del equipo.",
      "action": "allow",
      "intent": "patient_running_late",
      "description": "La paciente avisa que llegará tarde o que no sabe si llegará a la hora."
    },
    {
      "id": "urgency_follow_up",
      "note": "Situación sensible: crear tarea HIGH y derivar a ginecólogo o servicio sanitario. No hacer triaje clínico.",
      "action": "allow",
      "intent": "urgency_report",
      "description": "La paciente reporta una urgencia con sangrado, dolor o síntomas."
    },
    {
      "id": "sensitive_situation",
      "note": "Situación sensible prioritaria. Crear tarea HIGH. No pedir muchos datos en el primer mensaje emocional.",
      "action": "allow",
      "intent": "sensitive_situation",
      "description": "La paciente comunica pérdida gestacional, aborto, diagnóstico grave o fallecimiento del bebé."
    },
    {
      "id": "medical_inquiry",
      "note": "Explicar que Ecobaby no realiza ese servicio y derivar a ginecólogo. No ofrecer eco emocional como sustituto.",
      "action": "allow",
      "intent": "medical_inquiry",
      "description": "La paciente pregunta por ecografías médicas, morfológicas, diagnósticas o cribados."
    },
    {
      "id": "product_inquiry",
      "note": "Responder precios de catálogo si están disponibles. Si requiere stock, personalización, reserva o envío, crear tarea.",
      "action": "allow",
      "intent": "product_inquiry",
      "description": "La paciente pregunta por productos físicos, revelación del sexo, nidos, recuerdos o envíos."
    },
    {
      "id": "product_stock_inquiry",
      "note": "Crear tarea para que el equipo compruebe stock. No confirmar disponibilidad desde la IA sin verificar.",
      "action": "allow",
      "intent": "product_stock_inquiry",
      "description": "La paciente pregunta por disponibilidad, stock, modelo o color de un producto."
    },
    {
      "id": "shipping_request",
      "note": "Pedir código postal, informar de envío normal 7 € y urgente 10 €, recopilar datos de envío y crear tarea.",
      "action": "allow",
      "intent": "shipping_request",
      "description": "La paciente quiere enviar un producto comprado o reservado."
    },
    {
      "id": "gift_card_request",
      "note": "Recopilar datos de la embarazada, sesión/pack, dedicatoria y de parte de quién. Crear tarea para generar tarjeta.",
      "action": "allow",
      "intent": "gift_card_request",
      "description": "La paciente quiere regalar una ecografía, sesión o pack y necesita una tarjeta regalo."
    },